DALIA_ID,Authors,License,Link,Title,Community,Description,Discipline,FileFormat,Keywords,Language,LearningResourceType,MediaType,ProficiencyLevel,PublicationDate,TargetGroup,RelatedWork,Size,Version
262be803-39ed-4d2a-abdb-63d9ccf8b478,NFDI4Chem : {organization http://www.wikidata.org/entity/Q96678459},proprietary,https://www.youtube.com/watch?v=Jm3CQYDKEVg&list=PLlTKDYkC1Ls8qss_8q7qefE8WNOrAnn0D&index=9,MInChI – InChI for Mixtures,NFDI4Chem (SR),An introduction to InChI for mixtures (MInChI). Recorded 8. Chemotion/NFDI4Chem Stammtisch (24/09/21) The “Stammtisch” will be held on the last Friday of each month at 2:00 PM (CET)! Interested? Register for the next Stammtisch: https://nfdi4chem.de/index.php/event/...,,,,en,,video,advanced beginner * competent,2022-01-07,student (BA) * student (MA) * student (PhD),,,
269521f5-88c6-4445-b80f-de7980ed0695,NFDI4Chem : {organization http://www.wikidata.org/entity/Q96678459},proprietary,https://www.youtube.com/watch?v=thDIqLHCIh4&list=PLlTKDYkC1Ls8qss_8q7qefE8WNOrAnn0D&index=10,StereoInChI,NFDI4Chem (SR),This video gives an introduction to StereoInChI. It was recorded at the 9. Chemotion/NFDI4Chem Stammtisch (29/10/21) The “Stammtisch” will be held on the last Friday of each month at 2:00 PM (CET)! Interested? Register for the next Stammtisch: https://nfdi4chem.de/index.php/event/...,,,,en,,video,advanced beginner * competent,2022-01-07,student (BA) * student (MA) * student (PhD),,,
283c6c14-5b8b-40e0-b7e6-a2e2a3a7dd14,NFDI4Chem : {organization http://www.wikidata.org/entity/Q96678459},proprietary,https://www.youtube.com/watch?v=7K6D2dTHqOY&list=PLlTKDYkC1Ls8qss_8q7qefE8WNOrAnn0D&index=11,eLabFTW,NFDI4Chem (SR),This video gives an overview on eLabFTW. It was recorded at the 10. Chemotion/NFDI4Chem Stammtisch (26/11/21) The “Stammtisch” will be held on the last Friday of each month at 2:00 PM (CET)! Interested? Register for the next Stammtisch: https://nfdi4chem.de/index.php/event/...,,,,en,,video,novice,2022-01-07,student (BA) * student (MA) * student (PhD),,,
ad8045e3-de17-4f09-afcb-190bbd03dfc5,NFDI4Chem : {organization http://www.wikidata.org/entity/Q96678459},proprietary,https://www.youtube.com/watch?v=4seeBlaM0_Y&list=PLlTKDYkC1Ls8qss_8q7qefE8WNOrAnn0D&index=12,Molecular Machine Learning,NFDI4Chem (SR),This video gives an introduction to molecular machine learning. It was recorded 11. Chemotion/NFDI4Chem Stammtisch (28/01/22). The “Stammtisch” will be held on the last Friday of each month at 2:00 PM (CET)! Interested? Register for the next Stammtisch: https://nfdi4chem.de/index.php/event/...,,,,en,,video,novice * advanced beginner,2022-02-09,student (MA) * student (PhD) * researcher,,,
34e60a6d-dcb1-4135-8efd-ab4c6aa8b71a,NFDI4Chem : {organization http://www.wikidata.org/entity/Q96678459},proprietary,https://www.youtube.com/watch?v=u24VYFAzIFo&list=PLlTKDYkC1Ls8qss_8q7qefE8WNOrAnn0D&index=13,RADAR4Chem - A New Data Publication Repository,NFDI4Chem (SR),This video gives an introduction to RADAR4Chem. It was recorded 12. Chemotion/NFDI4Chem Stammtisch (25/02/22) The “Stammtisch” will be held on the last Friday of each month at 2:00 PM (CET)! Interested? Register for the next Stammtisch: https://nfdi4chem.de/index.php/event/...,,,,en,,video,advanced beginner * competent,2022-04-11,student (MA) * student (PhD) * researcher,,,
63cb3b54-d45c-4697-ab32-3d33da9d47c5,NFDI4Chem : {organization http://www.wikidata.org/entity/Q96678459},proprietary,https://www.youtube.com/watch?v=5z_QN-xBd-o&list=PLlTKDYkC1Ls8qss_8q7qefE8WNOrAnn0D&index=14,Lead-by-example: Pragmatic RDM in Chemistry,NFDI4Chem (SR),This video gives an overview on lead-by-example: pragmatic RDM in chemistry. It was recorded at the 13. Chemotion/NFDI4Chem Stammtisch (25/03/22) The “Stammtisch” will be held on the last Friday of each month at 2:00 PM (CET)! Interested? Register for the next Stammtisch: https://nfdi4chem.de/index.php/event/...,,,,en,,video,novice * advanced beginner * competent,2022-04-25,student (PhD) * researcher * data steward * content provider,,,
8788d2ea-8f25-4c92-81f2-6f898415d790,NFDI4Chem : {organization http://www.wikidata.org/entity/Q96678459},proprietary,https://www.youtube.com/watch?v=_9evhBMpRCg&list=PLlTKDYkC1Ls8qss_8q7qefE8WNOrAnn0D&index=15,Sciformation ELN & Sciflection,NFDI4Chem (SR),This video gives an introduction to Sciformation ELN and Sciflection. It was recorded at the 14. Chemotion/NFDI4Chem Stammtisch (29/04/22). The “Stammtisch” will be held on the last Friday of each month at 2:00 PM (CET)! Interested? Register for the next Stammtisch: https://nfdi4chem.de/index.php/event/...,,,,en,,video,novice * advanced beginner * competent * proficient,2022-09-21,student (PhD) * researcher,,,
b3461972-8856-4ec2-9190-16408ef89d02,NFDI4Chem : {organization http://www.wikidata.org/entity/Q96678459},proprietary,https://www.youtube.com/watch?v=KqFy1GYcqN0&list=PLlTKDYkC1Ls8qss_8q7qefE8WNOrAnn0D&index=16,Machine Learning Applications & Cheminfo,NFDI4Chem (SR),An introduction to Cheminfo and Machine Learning Applications. IRecorded at the 15. Chemotion/NFDI4Chem Stammtisch (20/05/22) The “Stammtisch” will be held on the last Friday of each month at 2:00 PM (CET)! Interested? Register for the next Stammtisch: https://nfdi4chem.de/index.php/event/...,,,,en,,video,advanced beginner * competent,2022-10-07,student (BA) * student (MA) * student (PhD) * researcher,,,
2eb0c479-f045-407c-9d78-0997ffe6d46d,NFDI4Chem : {organization http://www.wikidata.org/entity/Q96678459},proprietary,https://www.youtube.com/watch?v=g5hb6YJOE9k&list=PLlTKDYkC1Ls8qss_8q7qefE8WNOrAnn0D&index=17,News from the InChI,NFDI4Chem (SR),"An overview on the latest developments within InChI. Recorded at the 17. Chemotion/NFDI4Chem ""Stammtisch""(30/09/22). The “Stammtisch” will be held on the last Friday of each month at 2:00 PM (CET)! Interested? Register for the next Stammtisch: https://nfdi4chem.de/index.php/event/... ",,,,en,,video,advanced beginner * competent,2022-10-26,student (BA) * student (MA) * student (PhD) * researcher,,,
f0f049a8-913b-4c1f-b1b9-fa269a08eecf,NFDI4Chem : {organization http://www.wikidata.org/entity/Q96678459},proprietary,https://www.youtube.com/watch?v=H4N_WKKIx0M&list=PLlTKDYkC1Ls8qss_8q7qefE8WNOrAnn0D&index=20,LISTER: Semi-automatic metadata extraction in eLabFTW,NFDI4Chem (SR),"An overview on LISTER, a tool for semi-automatic metadata extraction from annotated experiment documentation in eLabFTW. This Video was recorded at the 19. Chemotion/NFDI4Chem ""Stammtisch"" (25/11/22) The “Stammtisch” will be held on the last Friday of each month at 2:00 PM (CET)! Interested? Register for the next Stammtisch: https://nfdi4chem.de/index.php/event/...",,,,en,,video,advanced beginner * competent,2022-12-07,student (PhD) * data steward * researcher,,,
ba01e7d3-fd8c-4614-a98a-892907bc3cf9,NFDI4Chem : {organization http://www.wikidata.org/entity/Q96678459},proprietary,https://www.youtube.com/watch?v=76lGyqaxDsk&list=PLlTKDYkC1Ls8qss_8q7qefE8WNOrAnn0D&index=21,Molbar,NFDI4Chem (SR),"A Biunique Molecular Identifier for Inorganic and Organic Molecules for Use in High-Throughput Screening Databases Talk from Nils van Staalduinen & Jun.-Prof. Christoph Bannwarth Recorded at the NFDI4Chem ""Stammtisch""(31/03/23). The “Stammtisch” will be held on the last Friday of each month at 2:00 PM (CET)! Interested? Register for the next Stammtisch: https://nfdi4chem.de/index.php/event/...",,,,en,,video,competent,2023-04-26,student (PhD),,,
58cb72ee-7051-4dd6-9404-b8d6e5a587a9,NFDI4Chem : {organization http://www.wikidata.org/entity/Q96678459},proprietary,https://www.youtube.com/watch?v=kP83BLvAUa8&list=PLlTKDYkC1Ls8qss_8q7qefE8WNOrAnn0D&index=22,Dalia,NFDI4Chem (SR),"From NFDI4Chem towards DALIA: A Knowlegde Graph for FAIR Data Usage and Provision Recorded at the NFDI4Chem ""Stammtisch""(27/01/23). The “Stammtisch” will be held on the last Friday of each month at 2:00 PM (CET)! Interested? Register for the next Stammtisch: https://nfdi4chem.de/index.php/event/... ",,,,en,,video,advanced beginner,2023-04-26,teacher (higher education) * data steward,,,
929bba7b-296b-477c-b219-89c78fd4048e,NFDI4Chem : {organization http://www.wikidata.org/entity/Q96678459},proprietary,https://www.youtube.com/watch?v=LA-IlhL-f5A&list=PLlTKDYkC1Ls8qss_8q7qefE8WNOrAnn0D&index=23,Generic Elements in Chemotion,NFDI4Chem (SR),Talk: Fabian Fink Recorded at the 21. NFDI4Chem-Stammtisch (24.02.2023) The “Stammtisch” will be held on the last Friday of each month at 2:00 PM (CET)! Interested? Register for the next Stammtisch: https://nfdi4chem.de/index.php/event/.,,,,en,,video,novice,2023-04-26,student (BA) * researcher,,,
d17ca34f-36eb-4bd6-8877-d0d80a45609f,NFDI4Chem : {organization http://www.wikidata.org/entity/Q96678459},proprietary,https://www.youtube.com/watch?v=dUX4KkGs0Yg&list=PLlTKDYkC1Ls8qss_8q7qefE8WNOrAnn0D&index=24,Introduction to LOGS ELN,NFDI4Chem (SR),"Introduction to LOGS-ELN – an ELN for spectroscopists with its own integrated SDMS (Scientific Data Management System, by Dr. Jakob J. Lopez & Dr. Sina Kazemi It was recorded at the first ""Stammtisch"" on the Electronic Laboratory Notebook and Repository Chemotion (28/04/23) . In order to best serve the needs of the whole chemical community, the “Stammtisch” offers space for suggestions and enhancements all around Chemotion. The “Stammtisch” will be held on the last Friday of each month at 2:00 PM (CET)! Interested? Register for the next Stammtisch: https://www.nfdi4chem.de/nfdi4chem-st...",,,,en,,video,advanced beginner * competent,2023-12-05,student (BA) * student (MA) * student (PhD),,,
e82ad6cb-f7b6-4e62-92c5-d6ad77436f8d,NFDI4Chem : {organization http://www.wikidata.org/entity/Q96678459},proprietary,https://www.youtube.com/watch?v=e7CN6lMzF-4&list=PLlTKDYkC1Ls8qss_8q7qefE8WNOrAnn0D&index=25,Chemical Ontologies,NFDI4Chem (SR),"Introduction to Chemical Ontologies by Philip Strömert It was recorded at the ""Stammtisch"" on the Electronic Laboratory Notebook and Repository Chemotion (26/05/23) . In order to best serve the needs of the whole chemical community, the “Stammtisch” offers space for suggestions and enhancements all around Chemotion. The “Stammtisch” will be held on the last Friday of each month at 2:00 PM (CET)! Interested? Register for the next Stammtisch: https://www.nfdi4chem.de/nfdi4chem-st... ",,,,en,,video,novice * advanced beginner * competent,2023-12-12,student (MA) * student (PhD) * data steward,,,
4697799a-6bfe-4d14-8a69-d50c7391b508,NFDI4Chem : {organization http://www.wikidata.org/entity/Q96678459},proprietary,https://www.youtube.com/watch?v=jhvGx3gaZTc&list=PLlTKDYkC1Ls8qss_8q7qefE8WNOrAnn0D&index=26,Blind prediction challenges as use cases for NFDI4Chem,NFDI4Chem (SR),"Prof. Stefan M. Kast, Prof. Ricardo Mata, Dr. Nicolas Tielker & Michel Lim It was recorded at the ""Stammtisch"" on the Electronic Laboratory Notebook and Repository Chemotion (30/06/23) . In order to best serve the needs of the whole chemical community, the “Stammtisch” offers space for suggestions and enhancements all around Research Data Management in Chemistry. The “Stammtisch” will be held on the last Friday of each month at 2:00 PM (CET)! Interested? Register for the next Stammtisch: https://www.nfdi4chem.de/nfdi4chem-st... ",,,,en,,video,competent,2024-01-25,student (PhD),,,
12f9a67c-4222-4b5a-9033-7bb9f0e32aa5,NFDI4Chem : {organization http://www.wikidata.org/entity/Q96678459},proprietary,https://www.youtube.com/watch?v=W1XzXk1NdOk&list=PLlTKDYkC1Ls8qss_8q7qefE8WNOrAnn0D&index=27,Research data management with LinkAhead,NFDI4Chem (SR),"Introduction by Timm Fitschen, Indiscale It was recorded at the ""Stammtisch"" on the Electronic Laboratory Notebook and Repository Chemotion (29/09/23) . In order to best serve the needs of the whole chemical community, the “Stammtisch” offers space for suggestions and enhancements all around Research Data Management in Chemistry. The “Stammtisch” will be held on the last Friday of each month at 2:00 PM (CET)! Interested? Register for the next Stammtisch: https://www.nfdi4chem.de/nfdi4chem-st...",,,,en,,video,advanced beginner,2024-02-02,student (MA) * student (PhD) * data steward,,,
261fbeb3-35c0-4c20-b39d-e64ddd1a9f3c,NFDI4Chem : {organization http://www.wikidata.org/entity/Q96678459},proprietary,https://www.youtube.com/watch?v=A0aZ2QEzsys,"FAIR data: no longer optional, but it takes a village!",NFDI4Chem (SR),"NFDI Physical Sciences Joint Colloquium with: Susanna Assunta Sansone, , Academic Lead of Research Practice; Professor of Data Readiness, Dep of Engineering Science; Associate Director, Oxford e-Research Centre. Abstract: The FAIR Principles, we have co-authored, have propelled the global debate in all disciplines on the importance of Findable, Accessible, Interoperable, and Reusable data, by humans and machines, and the need for better research data management, transparent and reproducible data worldwide. FAIR has united stakeholders world-wide behind a common concept: good data management under common standards. FAIR is a fundamental enabler for digital transformation in the public and in the private sectors. It is no longer optional. However, the FAIR Principles are aspirational, and putting FAIR into practice is work in progress; it “takes a village”! Starting with a brief history of the Principles, Susanna will paint the landscape of key initiatives and community activities for FAIR data, including resources like FAIRsharing (https://fairsharing.org/) for standards, databases and policies, tools like ISA (https://isa-tools.org) for describing the experimental details, and educational resources such as the FAIR Cookbook (https://faircookbook.elixir-europe.org) with best practices for research data management and hands-on recipes to make and keep data FAIR.",,,,en,,video,proficient,2023-01-12,student (PhD) * data steward * researcher,,,
f5c18fdd-843d-46e3-8590-3b18d4ab6b76,"Golub, Benjamin : {https://orcid.org/0000-0003-4374-909X} * Draheim, Christina : {https://orcid.org/0000-0002-0234-0514} * Wulle, Stefan : {https://orcid.org/0000-0001-5438-4327}",CC-BY-SA-4.0,https://doi.org/10.57747/pharmrxiv-2023041040405-000,A Practical Guide to FAIR Research Data Management in Medicinal Chemistry,NFDI4Chem (SR),"Scientists produce huge amounts of data every day, unfortunately not the full potential of these data is exploited. Most of the time, data is generated in a special project, kept within only one working group and forgotten after a few years. Eventually, the interest in these data arises again, but unfortunately, the data then is lost for different reasons: The data cannot be found, the data cannot be opened because the software is no longer supported, the documentation of the data is incomplete, so nobody understands the data anymore, and the list goes on. To avoid these issues, the FAIR principles [1] for good research data management were established, which are required by more and more funders, e.g., the DFG, and journals, e.g. ChemMedChem. But the scientists are not left alone with these new challenges. The NFDI4Chem [2] and SIS Pharmacy [3] support with tools, information materials, workshops and more to make the transition to FAIR research data as easy as possible. In this poster, we want to offer support to scientists which are new to the field of FAIR research data management. We will give an overview of the important concepts and principles, useful tools and offer starting points on how to start with FAIR research data management. In detail, FAIR principles, electronic lab notebooks (ELNs), data management plans (DMPs), repositories will be introduced, and a practical guide starting now with good research data management, will be presented. [1] M. D. Wilkinson at al., Sci Data, 2016, 3, 160018/1-9. [2] S. Herres-Pawlis, BFDM, 2021, 34-45. [3] C. Draheim et al., PZ Prisma. 2019, 26(2), 68-74.",https://w3id.org/kim/hochschulfaechersystematik/n107 * https://w3id.org/kim/hochschulfaechersystematik/n48 * https://w3id.org/kim/hochschulfaechersystematik/n40 * https://w3id.org/kim/hochschulfaechersystematik/n41,.pdf,Pharmazie * Chemie * Fachinformationsdienst * Forschungsdatenmanagement * NFDI4Chem * pharmacy * chemistry * Specialised Information Service * NFDI4Chem * research data management,en,Poster,,novice * advanced beginner,2023-04-14,student (BA) * student (MA) * student (PhD) * researcher,,1.7,
2edf9c26-cc68-4aa4-bd0c-c6bf8cdbf672,"Jolliffe, John : {https://orcid.org/0000-0003-3341-9572}",CC-BY-4.0,https://doi.org/10.5281/zenodo.8307691,HeFDI Data Talk: Chemotion - An Introduction to an Open-Source ELN for FAIR Data,HeFDI - Hessische Forschungsdateninfrastrukturen (S) * NFDI4Chem (SR),"Electronic Lab Notebooks (ELNs) are a key prerequisite to a comprehensive documentation of research processes, the digital storage of research data, and their reuse. ELNs can be used to plan, record, store and - in combination with repositories - disclose experiments or research data. In the long run, the benefit of ELNs is the option to store and manage data in a standardized way and to enrich the data with (automatically generated) information such as metadata, identifiers and descriptors. For scientists, ELNs offer advantages such as faster research processes and a faster access to information. Selected benefits of the ELN Chemotion - an ELN that was designed for the discipline Chemistry - will be presented to show exemplarily the use of research data management tools. The ELN offers special features for chemical work and includes diverse functions that allow the use of the ELN also in other disciplines. Both, the chemistry specific as well as the generic and adaptable modules will be presented in brief.  Chemotion ELN can be used in combination with the open access repository Chemotion. The disclosure of research data to the public is possible by a direct transfer of information from the ELN to the repository. The interoperable systems ELN and repository guarantee on the one hand an easy process for the disclosure of information and on the other hand the availability of comprehensive data including primary data and descriptions.  The systems Chemotion ELN and Chemotion Repository are part of the strategy of the National Research Data Infrastructure for Chemistry (NFDI4Chem) in Germany. Dr. John Jolliffe from NFDI4Chem will present the strategy and measures of NFDI4Chem in brief.",,.pdf,Forschungsdatenmanagement * FDM * Chemie * Forschungsdateninfrastruktur * Infrastruktur * Elektronisches Laborbuch * ELB * Repositorium * Metadaten * FAIRe Daten * FAIR-Prinzipien * research data management * RDM * chemistry * research data infrastructure * infrastructure * electronic lab notebook * ELN * repository * metadata * FAIR data * FAIR principles * HeFDI Data Talk,en,,presentation,novice,2023-05-05,student (BA),,7.3,1
beae805d-f48a-4696-8a1c-eaa22a7c37f6,"Jolliffe, John : {https://orcid.org/0000-0003-3341-9572}",CC-BY-4.0,https://doi.org/10.5281/zenodo.8252090,Chemotion. An Introduction to an Open-Source ELN for FAIR Data,HeFDI - Hessische Forschungsdateninfrastrukturen (S) * NFDI4Chem (SR),"Electronic Lab Notebooks (ELNs) are a key prerequisite to a comprehensive documentation of research processes, the digital storage of research data, and their reuse. ELNs can be used to plan, record, store and - in combination with repositories - disclose experiments or research data. In the long run, the benefit of ELNs is the option to store and manage data in a standardized way and to enrich the data with (automatically generated) information such as metadata, identifiers and descriptors. For scientists, ELNs offer advantages such as faster research processes and a faster access to information. Selected benefits of the ELN Chemotion - an ELN that was designed for the discipline Chemistry - will be presented to show exemplarily the use of research data management tools. The ELN offers special features for chemical work and includes diverse functions that allow the use of the ELN also in other disciplines. Both, the chemistry specific as well as the generic and adaptable modules will be presented in brief.  Chemotion ELN can be used in combination with the open access repository Chemotion. The disclosure of research data to the public is possible by a direct transfer of information from the ELN to the repository. The interoperable systems ELN and repository guarantee on the one hand an easy process for the disclosure of information and on the other hand the availability of comprehensive data including primary data and descriptions.  The systems Chemotion ELN and Chemotion Repository are part of the strategy of the National Research Data Infrastructure for Chemistry (NFDI4Chem) in Germany. Dr. John Jolliffe from NFDI4Chem will present the strategy and measures of NFDI4Chem in brief.",,.pdf,Forschungsdatenmanagement * FDM * Chemie * Forschungsdateninfrastruktur * Infrastruktur * Elektronisches Laborbuch * ELB * Repositorium * Metadaten * FAIRe Daten * FAIR-Prinzipien * research data management * RDM * chemistry * research data infrastructure * infrastructure * electronic lab notebook * ELN * repository * metadata * FAIR data * FAIR principles,en,,presentation,novice * advanced beginner,2023-06-16,student (BA) * student (MA),,5.6,1
0bed2723-f337-4b2d-bfbe-256210724a1d,"Strömert, Philip : {https://orcid.org/0000-0002-1595-3213} * Hunold, Johannes : {https://orcid.org/0000-0002-4378-6061} * Neumann, Steffen : {https://orcid.org/0000-0002-7899-7192}",CC-BY-4.0,https://doi.org/10.5281/zenodo.7839664,NFDI4C* Workshop on synergy & cooperation,NFDI4Chem (SR) * NFDI4Cat (S),"A short presentationthat was held in the breakout session ""ontologies & metadata"" of the NFDI4Chem & NFDI4Cat joint workshop.",,.pdf,Forschungsdatenmanagement * FDM * Chemie * Forschungsdateninfrastruktur * Infrastruktur * Elektronisches Laborbuch * ELB * Repositorium * Metadaten * FAIRe Daten * FAIR-Prinzipien * research data management * RDM * chemistry * research data infrastructure * infrastructure * electronic lab notebook * ELN * repository * metadata * FAIR data * FAIR principles * HeFDI Data Talk,en,,presentation,competent * proficient,2023-05-05,student (PhD) * data steward,,4.8,1
3852d134-cb5a-447b-b44d-42e5deebe8a8,"Castro, Leyla Jael : {https://orcid.org/0000-0003-3986-0510} * Fluck, Juliane : {https://orcid.org/0000-0003-1379-7023} * Arend, Daniel : {https://orcid.org/0000-0002-2455-5938} * Lange, Matthias : {https://orcid.org/0000-0002-2455-5938} *  Martini, Daniel : {https://orcid.org/0000-0002-6953-4524} * Neumann, Steffen : {https://orcid.org/0000-0002-7899-7192} * Schimmler, Sonja : {https://orcid.org/0000-0002-8786-7250} * Rebholz-Schuhmann, Dietrich : {https://orcid.org/0000-0002-1018-0370}",CC-BY-4.0,https://doi.org/10.5281/zenodo.8331237,Schema.org as a Lightweight Harmonization Approach for NFDI,FAIRagro (S) * ZB Med (S) * NFDI4DataScience (S) * NFDI4Chem (SR) * NFDI4Health (S) * DataPLANT (S),"Schema.org is a controlled vocabulary that makes it easier for web pages to describe their actual content in a semantic, structured and machine-processable way. It is recognized by major search engines and data aggregators, making it easier for researchers to expose metadata describing their research outcomes. Here we present how Schema.org is used (or planned to be used) by some NFDI consortia, becoming a lightweight approach to harmonize digital objects coming from different sources so they can be connected to each other in a meaningful way.",,.pdf,Metadata * Structured * Markup * JSON-LD * schema.org * Bioschemas * OAI-PMH * Harvesting,en,,presentation,competent * proficient,2023-09-13,student (PhD) * data steward,isSupplementTo:https://doi.org/10.52825/cordi.v1i.280,7.3,1
6ca2e9db-c5cd-4b11-b7a9-fc3f5bb3ec74,"Strömert, Philip : {https://orcid.org/0000-0002-1595-3213}",CC-BY-4.0,https://doi.org/10.5281/zenodo.7623878,Setting up your own ODK ontology repository,NFDI4Chem (SR),Presentation given at the Ontology Summit 2023 about how to set up a Git repository with the Ontology Development Kit (ODK).,,.pdf,,en,,presentation,expert * proficient,2023-02-09,data steward,,1.3,1
5b37f837-9127-4211-aead-9c1b80945474,"Jolliffe, John : {https://orcid.org/0000-0003-3341-9572}",CC-BY-4.0,https://doi.org/10.5281/zenodo.7961306,NFDI4Chem bei der SaxFDM Digital Kitchen am 11.05.2023,NFDI4Chem (SR) * SaxFDM (S),Am 11.05.2023 war Dr. John Jolliffe bei der SaxFDM Digital Kitchen zu Gast und hat über die Angebote und Services des NFDI4Chem berichtet. Hier die Folien noch einmal zum nachlesen.,,.pdf,SaxFDM * Digital Kitchen * NFDI4Chem,en,,presentation,novice,2023-05-23,student (BA),,6.4,1
cb2108bd-409f-4c08-8c9e-8c2a89567283,"Herres-Pawlis, Sonja : {https://orcid.org/0000-0002-4354-4353} * Bach, Felix : {https://orcid.org/0000-0002-5035-7978} * Jung, Nicole : {https://orcid.org/0000-0001-9513-2468} * Koepler, Oliver : {https://orcid.org/0000-0003-3385-4232} * Liermann, Johannes : {https://orcid.org/0000-0003-2060-842X} * Neumann, Steffen : {https://orcid.org/0000-0002-7899-7192} * Razum, Matthias : {https://orcid.org/0000-0002-5139-5511} * Steinbeck, Christoph : {https://orcid.org/0000-0001-6966-0814} * Fink, Fabian : {https://orcid.org/0000-0002-1863-2087} * Hoffmann, Alexander : {https://orcid.org/0000-0002-9647-8839} * Ortmeyer, Jochen : {https://orcid.org/0000-0003-2074-8027} * Jollife, John : {https://orcid.org/0000-0003-3341-9572}",CC-BY-4.0,https://doi.org/10.5281/zenodo.8340454,NFDI4Chem: from chemical research data management to digital chemistry,NFDI4Chem (SR),"This presentation was held at the GDCh-Wissenschaftsforum (WiFo) ""Rethinking Chemistry"" 2023 in Leipzig.",,.pdf,,en,,presentation,novice,2023-09-13,student (BA),,3.2,1
