DALIA_ID,Authors,License,Link,Title,Community,Description,Discipline,FileFormat,Keywords,Language,LearningResourceType,MediaType,ProficiencyLevel,PublicationDate,TargetGroup,RelatedWork,Size,Version
40a5e2e1-81e9-4fe2-9fbe-4129debd0d4b,NFDI4Chem : {organization http://www.wikidata.org/entity/Q96678459},proprietary,https://www.youtube.com/watch?v=Nu4gj07CTuQ&list=PLlTKDYkC1Ls8wiHU-DzN1KwapxRpLkfVa&index=2,"Ontologies4Chem Workshop Day 1 Part 2 - Chemistry Ontologies, past and current developments",NFDI4Chem (SR),"Day 1 Part 2 covers reports from major chemistry ontologies including the IUPAC Gold Book - Compendium of Chemical Terminology, Chemical Entities of Biological Interest (ChEBI), the Chemical Information Ontology (CHEMINF), ontologies of the Royal Society of Chemistry: the the Molecular Process Ontology (MOP), the Named Reaction Ontology (RXNO) and the Chemical Methods Ontology (CHMO), Chemical Relations and ChEBI Integrated Role Ontology (ChIRO), Chemical Entity Materials and Reactions Ontological Framework (ChEMROF), the ontology of operations, data types, formats, identifiers and topics (EDAM) , the Ontology of Biomedical Investigations (OBI), the Semanticscience Integrated Ontology (SIO) and Bioschemas.org. The workshop provided a comprehensive overview of past and current activities of chemistry ontology projects, tools for ontology engineering and the application and curation of ontogologies in research data management. Recording Day 1 Part 2 of the 1st International Ontologies4Chem Workshopy organized by NFDI4Chem - the chemistry consortium in the NFDI. Scroll down for links to chaptes in the video Details: https://doi.org/10.25798/frnp-sn04 ",,,,en,,video,advanced beginner * competent,2022-09-27,student (PhD) * researcher * data steward,,,
7e6ceaa2-6b54-4c58-ae04-073b164bebf6,NFDI4Chem : {organization http://www.wikidata.org/entity/Q96678459},proprietary,https://www.youtube.com/watch?v=FC9sAweUjpw&list=PLlTKDYkC1Ls8wiHU-DzN1KwapxRpLkfVa&index=3,Ontologies4Chem Workshop Day 1 Part 3 - Chemistry and other ontologies in related NFDI consortia,NFDI4Chem (SR),"In this video the consortia NFDI4Health and NFDI4Cat presents their application of chemistry ontologies and others of their domain. The workshop provided a comprehensive overview of past and current activities of chemistry ontology projects, tools for ontology engineering and the application and curation of ontogologies in research data management. Recording Day 1 Part 3 of the 1st International Ontologies4Chem Workshopy organized by NFDI4Chem - the chemistry consortium in the NFDI. Details: https://doi.org/10.25798/frnp-sn04",,,,en,,video,competent,2022-09-27,student (PhD) * researcher * data steward,,,
a1ec655d-71a3-4c10-8a8b-7c60678de274,NFDI4Chem : {organization http://www.wikidata.org/entity/Q96678459},proprietary,https://www.youtube.com/watch?v=7Uj3JGUXKLQ&list=PLlTKDYkC1Ls8wiHU-DzN1KwapxRpLkfVa&index=4,Ontologies4Chem Workshop Day 1 Part 4 - Current Tool developments,NFDI4Chem (SR),"Day 1 Part 4 covers reports from tools used for providing search and browsing functionalities across ontology collections with the NFDI4Chem ontology service and ontology development and curation with ROBOT or the ontology development kit ODK. The workshop provided a comprehensive overview of past and current activities of chemistry ontology projects, tools for ontology engineering and the application and curation of ontogologies in research data management. Recording Day 1 Part 4 of the 1st International Ontologies4Chem Workshopy organized by NFDI4Chem - the chemistry consortium in the NFDI. Details: https://doi.org/10.25798/frnp-sn04",,,,en,,video,competent,2022-09-27,student (PhD) * researcher * data steward,,,
be1b5388-84a6-4de7-babd-42a2c8a3058a,NFDI4Chem : {organization http://www.wikidata.org/entity/Q96678459},proprietary,https://www.youtube.com/watch?v=5mfiF2881Ps&list=PLlTKDYkC1Ls8wiHU-DzN1KwapxRpLkfVa&index=5,Ontologies4Chem Workshop Day 2 Part 1 - Community-driven Ontology Development - Best practices,NFDI4Chem (SR),"Day 2 Part 1 covers reports on best practices with regards to community-driven ontology development. The NFDI4Cat consortium presents its Ontology Workflow, NFDI4Chem presents onging work on the ontology development for Raman & NMR in NFDI4Chem, and the adaption of (Bio) Schemas4Chem for chemistry. Recording Day 2 Part 1 of the 1st International Ontologies4Chem Workshopy organized by NFDI4Chem - the chemistry consortium in the NFDI. The workshop provided a comprehensive overview of past and current activities of chemistry ontology projects, tools for ontology engineering and the application and curation of ontogologies in research data management. Details: https://doi.org/10.25798/frnp-sn04",,,,en,,video,competent,2022-09-27,student (PhD) * researcher * data steward,,,
76e18c8a-30a3-4217-81db-62e6343a6892,NFDI4Chem : {organization http://www.wikidata.org/entity/Q96678459},proprietary,https://www.youtube.com/watch?v=Bm-4fScOdrE&list=PLlTKDYkC1Ls8wiHU-DzN1KwapxRpLkfVa&index=6,Ontologies4Chem workshop Day 2 Part 2 - Tools used in projects for data annotations,NFDI4Chem (SR),"Day 2 Part 2 covers reports about tools used in projects for data annotations like the application of ontologies in ELN and data repositories in NFDI4Chem, the IUPAC FairSpec project and how to integrate vocabularies into established discipline-specific ontologies. The use of ontologies for the data annotation in Pubchem and ClassyFire for automated chemical classification and applications. Recording Day 2 Part 2 of the 1st International Ontologies4Chem Workshopy organized by NFDI4Chem - the chemistry consortium in the NFDI. The workshop provided a comprehensive overview of past and current activities of chemistry ontology projects, tools for ontology engineering and the application and curation of ontogologies in research data management. Details: https://doi.org/10.25798/frnp-sn04",,,,en,,video,competent,2022-09-27,student (PhD) * researcher * data steward,,,
ae547968-5b33-40aa-8e55-51c2e6af10df,NFDI4Chem : {organization http://www.wikidata.org/entity/Q96678459},proprietary,https://www.youtube.com/watch?v=7JvoCrH8KdM&list=PLlTKDYkC1Ls_Vvym6FY1hdDzA1VcPGu9i&index=1,Introduction to NFDI4Chem & Ontologies4Chem,NFDI4Chem (SR),Part 1 of the 2. Ontologies4Chem Workshop – 11./12.10.23 In this 2. workshop we deepened the discussions around the existing chemical ontologies to address questions around the need of being able to recommend them as canonical resources and around how to improve them. We also discussed tools that can be used in an ontology-based research data management context. Details: https://doi.org/10.25798/dd81-f712,,,,en,,video,advanced beginner * competent * proficient * expert,2023-11-15,data steward * content provider,,,
182c0d30-1908-440a-ab40-a5d947058336,NFDI4Chem : {organization http://www.wikidata.org/entity/Q96678459},proprietary,https://www.youtube.com/watch?v=ETST4vNM0zs&list=PLlTKDYkC1Ls_Vvym6FY1hdDzA1VcPGu9i&index=2,NFDI4Chem Terminology Service News & Updates,NFDI4Chem (SR),Part 2 of the 2. Ontologies4Chem Workshop – 11./12.10.23 In this 2. workshop we deepened the discussions around the existing chemical ontologies to address questions around the need of being able to recommend them as canonical resources and around how to improve them. We also discussed tools that can be used in an ontology-based research data management context. Details: https://doi.org/10.25798/dd81-f712,,,,en,,video,competent * proficient * expert,2023-11-15,data steward * content provider,,,
13fbe24d-0c2e-46b2-b166-2f1def45b677,NFDI4Chem : {organization http://www.wikidata.org/entity/Q96678459},proprietary,https://www.youtube.com/watch?v=EdzGnN344xI&list=PLlTKDYkC1Ls_Vvym6FY1hdDzA1VcPGu9i&index=3,Gathering the Landscape of Ontologies for Catalysis Research,NFDI4Chem (SR),Part 3 of the 2. Ontologies4Chem Workshop – 11./12.10.23 In this 2. workshop we deepened the discussions around the existing chemical ontologies to address questions around the need of being able to recommend them as canonical resources and around how to improve them. We also discussed tools that can be used in an ontology-based research data management context. Details: https://doi.org/10.25798/dd81-f712,,,,en,,video,competent * proficient * expert,2023-11-15,data steward * content provider,,,
1152127d-a6d5-4073-b881-3ee983b902c4,NFDI4Chem : {organization http://www.wikidata.org/entity/Q96678459},proprietary,https://www.youtube.com/watch?v=WnacPWpG72s&list=PLlTKDYkC1Ls_Vvym6FY1hdDzA1VcPGu9i&index=4,eNanoMapper Ontology: Updated curation and development workflowsCHEMINF Updates,NFDI4Chem (SR),Part 5 of the 2. Ontologies4Chem Workshop – 11./12.10.23 In this 2. workshop we deepened the discussions around the existing chemical ontologies to address questions around the need of being able to recommend them as canonical resources and around how to improve them. We also discussed tools that can be used in an ontology-based research data management context. Details: https://doi.org/10.25798/dd81-f712,,,,en,,video,competent * proficient * expert,2023-11-15,data steward * content provider,,,
bd802e96-4573-4025-bb6a-dc8a713c6124,NFDI4Chem : {organization http://www.wikidata.org/entity/Q96678459},proprietary,https://www.youtube.com/watch?v=MqHEA7VSLxs&list=PLlTKDYkC1Ls_Vvym6FY1hdDzA1VcPGu9i&index=5,"Status update on CHMO, PROCO, RXNO & MOP, VIBSO",NFDI4Chem (SR),Part 6 of the 2. Ontologies4Chem Workshop – 11./12.10.23 In this 2. workshop we deepened the discussions around the existing chemical ontologies to address questions around the need of being able to recommend them as canonical resources and around how to improve them. We also discussed tools that can be used in an ontology-based research data management context. Details: https://doi.org/10.25798/dd81-f712,,,,en,,video,competent * proficient * expert,2023-11-15,data steward * content provider,,,
9cd646ba-1743-4c61-9630-b29fb37b1664,NFDI4Chem : {organization http://www.wikidata.org/entity/Q96678459},proprietary,https://www.youtube.com/watch?v=Ba7JuMzDLXU&list=PLlTKDYkC1Ls_Vvym6FY1hdDzA1VcPGu9i&index=6,Lessons Learned - Domain Experts Need Easier Tooling to Work with Ontologies,NFDI4Chem (SR),Part 7 of the 2. Ontologies4Chem Workshop – 11./12.10.23 In this 2. workshop we deepened the discussions around the existing chemical ontologies to address questions around the need of being able to recommend them as canonical resources and around how to improve them. We also discussed tools that can be used in an ontology-based research data management context. Details: https://doi.org/10.25798/dd81-f712,,,,en,,video,competent * proficient * expert,2023-11-15,data steward * content provider,,,
3f0610f5-ad68-4c29-a23f-216c9f24de0d,NFDI4Chem : {organization http://www.wikidata.org/entity/Q96678459},proprietary,https://www.youtube.com/watch?v=c-QmGjhEdIQ&list=PLlTKDYkC1Ls_Vvym6FY1hdDzA1VcPGu9i&index=7,SKOS vocabulary development with Excel and GitHub,NFDI4Chem (SR),Part 8 of the 2. Ontologies4Chem Workshop – 11./12.10.23 In this 2. workshop we deepened the discussions around the existing chemical ontologies to address questions around the need of being able to recommend them as canonical resources and around how to improve them. We also discussed tools that can be used in an ontology-based research data management context. Details: https://doi.org/10.25798/dd81-f712,,,,en,,video,competent * proficient * expert,2023-11-15,data steward * content provider,,,
5f7cd679-4627-443f-a769-b6d8de275df5,NFDI4Chem : {organization http://www.wikidata.org/entity/Q96678459},proprietary,https://www.youtube.com/watch?v=qd4HpsX0kME&list=PLlTKDYkC1Ls_Vvym6FY1hdDzA1VcPGu9i&index=8,Reviving nmrCV or integrating it with CHMO,NFDI4Chem (SR),Part 9 of the 2. Ontologies4Chem Workshop – 11./12.10.23 In this 2. workshop we deepened the discussions around the existing chemical ontologies to address questions around the need of being able to recommend them as canonical resources and around how to improve them. We also discussed tools that can be used in an ontology-based research data management context. Details: https://doi.org/10.25798/dd81-f712,,,,en,,video,competent * proficient * expert,2023-11-15,data steward * content provider,,,
2018b2a5-ec4d-4dde-87ac-82696881d44f,NFDI4Chem : {organization http://www.wikidata.org/entity/Q96678459},proprietary,https://www.youtube.com/watch?v=Ke_ZIEiNDmw&list=PLlTKDYkC1Ls_Vvym6FY1hdDzA1VcPGu9i&index=9,IUPAC’s Gold Book & its potential use as a canonical source for textual definitions in ontologies,NFDI4Chem (SR),Part 10 of the 2. Ontologies4Chem Workshop – 11./12.10.23 In this 2. workshop we deepened the discussions around the existing chemical ontologies to address questions around the need of being able to recommend them as canonical resources and around how to improve them. We also discussed tools that can be used in an ontology-based research data management context. Details: https://doi.org/10.25798/dd81-f712,,,,en,,video,competent * proficient * expert,2023-11-15,data steward * content provider,,,
1faeb178-acf0-46de-b274-18f34abcb70a,NFDI4Chem : {organization http://www.wikidata.org/entity/Q96678459},proprietary,https://www.youtube.com/watch?v=JjykoMouGYY&list=PLlTKDYkC1Ls_Vvym6FY1hdDzA1VcPGu9i&index=10,"FAIR Ontology Metadata - Crucial Information for Understanding, Evaluation, and Application",NFDI4Chem (SR),Part 11 of the 2. Ontologies4Chem Workshop – 11./12.10.23 In this 2. workshop we deepened the discussions around the existing chemical ontologies to address questions around the need of being able to recommend them as canonical resources and around how to improve them. We also discussed tools that can be used in an ontology-based research data management context. Details: https://doi.org/10.25798/dd81-f712,,,,en,,video,competent * proficient * expert,2023-11-15,data steward * content provider,,,
2461c215-88c1-437a-9e2d-392a62bd30d4,NFDI4Chem : {organization http://www.wikidata.org/entity/Q96678459},proprietary,https://www.youtube.com/watch?v=w2Br-CXKrfw&list=PLlTKDYkC1Ls_Vvym6FY1hdDzA1VcPGu9i&index=11,"Standardization of chemical prefixes, CURIEs, URIs, and semantic mappings",NFDI4Chem (SR),Part 12 of the 2. Ontologies4Chem Workshop – 11./12.10.23 In this 2. workshop we deepened the discussions around the existing chemical ontologies to address questions around the need of being able to recommend them as canonical resources and around how to improve them. We also discussed tools that can be used in an ontology-based research data management context. Details: https://doi.org/10.25798/dd81-f712,,,,en,,video,competent * proficient * expert,2023-11-15,data steward * content provider,,,
53f71d2c-6420-4cbe-b580-46f1a2fa5628,NFDI4Chem : {organization http://www.wikidata.org/entity/Q96678459},proprietary,https://www.youtube.com/watch?v=Itin7YkUvZg&list=PLlTKDYkC1Ls_Vvym6FY1hdDzA1VcPGu9i&index=12,Metadata Annotation with Swate and Ontologies,NFDI4Chem (SR),Part 13 of the 2. Ontologies4Chem Workshop – 11./12.10.23 In this 2. workshop we deepened the discussions around the existing chemical ontologies to address questions around the need of being able to recommend them as canonical resources and around how to improve them. We also discussed tools that can be used in an ontology-based research data management context. Details: https://doi.org/10.25798/dd81-f712,,,,en,,video,competent * proficient * expert,2023-11-15,data steward * content provider,,,
09419963-00a5-4899-8a2f-aba5adc38a89,NFDI4Chem : {organization http://www.wikidata.org/entity/Q96678459},proprietary,https://www.youtube.com/watch?v=c2mV62wmVgo&list=PLlTKDYkC1Ls_Vvym6FY1hdDzA1VcPGu9i&index=13,Ontologies4Spreadsheets with OntoMaton,NFDI4Chem (SR),Part 14 of the 2. Ontologies4Chem Workshop – 11./12.10.23 In this 2. workshop we deepened the discussions around the existing chemical ontologies to address questions around the need of being able to recommend them as canonical resources and around how to improve them. We also discussed tools that can be used in an ontology-based research data management context. Details: https://doi.org/10.25798/dd81-f712,,,,en,,video,competent * proficient * expert,2023-11-15,data steward * content provider,,,
bff53a15-e612-4820-b8b4-2c1f482e61b5,NFDI4Chem : {organization http://www.wikidata.org/entity/Q96678459},proprietary,https://www.youtube.com/watch?v=d6eDN9xuFpw&list=PLlTKDYkC1Ls_Vvym6FY1hdDzA1VcPGu9i&index=14,Ontology Elements: Enabling Data Interoperability Across the Web Using Ontology-driven Rich HTML,NFDI4Chem (SR),Part 15 of the 2. Ontologies4Chem Workshop – 11./12.10.23 In this 2. workshop we deepened the discussions around the existing chemical ontologies to address questions around the need of being able to recommend them as canonical resources and around how to improve them. We also discussed tools that can be used in an ontology-based research data management context. Details: https://doi.org/10.25798/dd81-f712,,,,en,,video,competent * proficient * expert,2023-11-15,data steward * content provider,,,
6b18239f-1e3d-4a6d-9a03-45d25d167f70,NFDI4Chem : {organization http://www.wikidata.org/entity/Q96678459},proprietary,https://www.youtube.com/watch?v=sN50YkPsraI&list=PLlTKDYkC1Ls_Vvym6FY1hdDzA1VcPGu9i&index=15,Ontologies4SchemaOrg,NFDI4Chem (SR),Part 16 of the 2. Ontologies4Chem Workshop – 11./12.10.23 In this 2. workshop we deepened the discussions around the existing chemical ontologies to address questions around the need of being able to recommend them as canonical resources and around how to improve them. We also discussed tools that can be used in an ontology-based research data management context. Details: https://doi.org/10.25798/dd81-f712,,,,en,,video,competent * proficient * expert,2023-11-15,data steward * content provider,,,
c543a23e-f345-428e-a356-f7d802a494c4,NFDI4Chem : {organization http://www.wikidata.org/entity/Q96678459},proprietary,https://www.youtube.com/watch?v=ygcdnk2cjyg&list=PLlTKDYkC1Ls_Vvym6FY1hdDzA1VcPGu9i&index=16,Usage of Ontologies4SchemaOrg for the NFDI4Chem Search Service,NFDI4Chem (SR),Part 17 of the 2. Ontologies4Chem Workshop – 11./12.10.23 In this 2. workshop we deepened the discussions around the existing chemical ontologies to address questions around the need of being able to recommend them as canonical resources and around how to improve them. We also discussed tools that can be used in an ontology-based research data management context. Details: https://doi.org/10.25798/dd81-f712,,,,en,,video,competent * proficient * expert,2023-11-15,data steward * content provider,,,
206a4cee-403b-48be-bdbf-e8d9f92b5adb,NFDI4Chem : {organization http://www.wikidata.org/entity/Q96678459},proprietary,https://www.youtube.com/watch?v=Z4TqVWC9fnA&list=PLlTKDYkC1Ls_Vvym6FY1hdDzA1VcPGu9i&index=17,ChEBI Ontology 2.0 - What is new?,NFDI4Chem (SR),Part 4 of the 2. Ontologies4Chem Workshop – 11./12.10.23 In this 2. workshop we deepened the discussions around the existing chemical ontologies to address questions around the need of being able to recommend them as canonical resources and around how to improve them. We also discussed tools that can be used in an ontology-based research data management context. Details: https://doi.org/10.25798/dd81-f712,,,,en,,video,competent * proficient * expert,2023-11-15,data steward * content provider,,,
bdf57e50-1721-4a63-bdbb-f77cf638c0df,NFDI4Chem : {organization http://www.wikidata.org/entity/Q96678459},proprietary,https://www.youtube.com/watch?v=rxTpJ6fRZnc&list=PLlTKDYkC1Ls8qss_8q7qefE8WNOrAnn0D&index=1,Overview of NFDI4Chem,NFDI4Chem (SR),"A short introduction to the project NFDI4Chem. It was recorded at the first ""Stammtisch"" on the Electronic Laboratory Notebook and Repository Chemotion (29/01/21) . In order to best serve the needs of the whole chemical community, the “Stammtisch” offers space for suggestions and enhancements all around Chemotion. The “Stammtisch” will be held on the last Friday of each month at 2:00 PM (CET)! Interested? Register for the next Stammtisch: https://nfdi4chem.de/index.php/event/...",,,,en,,video,novice * advanced beginner,2021-02-16,student (BA),,,
6ff29c29-e718-4edd-91ab-62f24aa0e766,NFDI4Chem : {organization http://www.wikidata.org/entity/Q96678459},proprietary,https://www.youtube.com/watch?v=D1LXKNDIsIs&list=PLlTKDYkC1Ls8qss_8q7qefE8WNOrAnn0D&index=2,Overview ELN,NFDI4Chem (SR),"A short introduction to the ELN Chemotion. Recorded at the 1. Stammtisch Chemotion (29/01/21) In order to best serve the needs of the whole chemical community, the “Stammtisch” offers space for suggestions and enhancements all around Chemotion. The “Stammtisch” will be held on the last Friday of each month at 2:00 PM (CET)! Interested? Register for the next Stammtisch: https://nfdi4chem.de/index.php/event/... ",,,,en,,video,novice * advanced beginner,2021-02-16,student (BA),,,
082b5f2e-d807-4e33-ace1-1b0cbd0e2b73,NFDI4Chem : {organization http://www.wikidata.org/entity/Q96678459},proprietary,https://www.youtube.com/watch?v=KxVcwzFB3nw&list=PLlTKDYkC1Ls8qss_8q7qefE8WNOrAnn0D&index=3,Overview Repository,NFDI4Chem (SR),"A short introduction to the Repository of Chemotion. Recorded at 2. Stammtisch Chemotion (26/02/21) In order to best serve the needs of the whole chemical community, the “Stammtisch” offers space for suggestions and enhancements all around Chemotion. The “Stammtisch” will be held on the last Friday of each month at 2:00 PM (CET)! Interested? Register for the next Stammtisch: https://nfdi4chem.de/index.php/event/...",,,,en,,video,novice * advanced beginner,2021-03-19,student (BA),,,
427753d0-45f4-4c74-be59-4ddb8d6bf447,NFDI4Chem : {organization http://www.wikidata.org/entity/Q96678459},proprietary,https://www.youtube.com/watch?v=dNQeJPmty5Y&list=PLlTKDYkC1Ls8qss_8q7qefE8WNOrAnn0D&index=4,Introduction to Ontologies,NFDI4Chem (SR),"A short introduction to ontologies in chemistry. Recorded at the 3. Stammtisch Chemotion (26/03/21) In order to best serve the needs of the whole chemical community, the “Stammtisch” offers space for suggestions and enhancements all around Chemotion. The “Stammtisch” will be held on the last Friday of each month at 2:00 PM (CET)! Interested? Register for the next Stammtisch: https://nfdi4chem.de/index.php/event/...",,,,en,,video,novice * advanced beginner,2021-03-30,student (BA),,,
6513dfb7-5114-440a-b675-947ae4c3ac16,NFDI4Chem : {organization http://www.wikidata.org/entity/Q96678459},proprietary,https://www.youtube.com/watch?v=OarleAk03Bc&list=PLlTKDYkC1Ls8qss_8q7qefE8WNOrAnn0D&index=5,Chemotion from a User Perspective - Tips and Tricks,NFDI4Chem (SR),"Tips and tricks for the ELN Chemotion from a user perspective. Recorded at the fourth Stammtisch Chemotion (30/04/21) In order to best serve the needs of the whole chemical community, the “Stammtisch” offers space for suggestions and enhancements all around Chemotion. The “Stammtisch” will be held on the last Friday of each month at 2:00 PM (CET)! Interested? Register for the next Stammtisch: https://nfdi4chem.de/index.php/event/...",,,,en,,video,novice * advanced beginner,2021-05-06,student (BA) * student (MA),,,
d2d1af7b-5904-4b8f-a01e-d9df36986f14,NFDI4Chem : {organization http://www.wikidata.org/entity/Q96678459},proprietary,https://www.youtube.com/watch?v=Ke44aIP2bno&list=PLlTKDYkC1Ls8qss_8q7qefE8WNOrAnn0D&index=6,Basics of InChI,NFDI4Chem (SR),"An overview on the basics of InChI. Recorded at the 5. Stammtisch Chemotion (28/05/21) In order to best serve the needs of the whole chemical community, the “Stammtisch” offers space for suggestions and enhancements all around Chemotion. The “Stammtisch” will be held on the last Friday of each month at 2:00 PM (CET)! Interested? Register for the next Stammtisch: https://nfdi4chem.de/index.php/event/...",,,,en,,video,advanced beginner,2021-07-14,student (BA) * student (MA) * student (PhD),,,
ea2e8aca-1224-4956-9deb-d920cc27aae3,NFDI4Chem : {organization http://www.wikidata.org/entity/Q96678459},proprietary,https://www.youtube.com/watch?v=ONHw7uy03tc&list=PLlTKDYkC1Ls8qss_8q7qefE8WNOrAnn0D&index=7,RInChI,NFDI4Chem (SR),"Introduction to RInChI. Recorded at the 6. Stammtisch Chemotion (25/06/21) In order to best serve the needs of the whole chemical community, the “Stammtisch” offers space for suggestions and enhancements all around Chemotion. The “Stammtisch” will be held on the last Friday of each month at 2:00 PM (CET)! Interested? Register for the next Stammtisch: https://nfdi4chem.de/index.php/event/...",,,,en,,video,advanced beginner * competent,2021-07-14,student (BA) * student (MA) * student (PhD),,,
0d70949d-e46e-4459-be3d-edd4d4ef6098,NFDI4Chem : {organization http://www.wikidata.org/entity/Q96678459},proprietary,https://www.youtube.com/watch?v=7qOnJto8tAk&list=PLlTKDYkC1Ls8qss_8q7qefE8WNOrAnn0D&index=8,InChI for Organometallics and Inorganics,NFDI4Chem (SR),Introduction to InChI for Organometallics and Inorganics. It was recorded at the 7. Chemotion/NFDI4Chem Stammtisch (30/07/21) The “Stammtisch” will be held on the last Friday of each month at 2:00 PM (CET)! Interested? Register for the next Stammtisch: https://nfdi4chem.de/index.php/event/...,,,,en,,video,advanced beginner * competent,2022-01-07,student (BA) * student (MA) * student (PhD),,,
