attribute name,DALIA_ID,Reason for learning resource removal,Authors,License,Link,Title,Community,Description,Discipline,FileFormat,Keywords,Language,LearningResourceType,MediaType,ProficiencyLevel,PublicationDate,TargetGroup,RelatedWork,Size,Version,ID
,f2b0fb1c-9539-43f4-81fc-3cb70f6f6581,,"Röder, Juliane : {https://orcid.org/0000-0002-4692-2700}",CC-BY-4.0,https://doi.org/10.5281/zenodo.11491277,Introduction to research data management,NFDI4Biodiversity (SR) * Philipps University of Marburg (SR),"Slides for a 30 min presentation on basic aspects of research data management. The first part discusses motivations and solutions for improved research data management specific for ecological and biodiversity data. The second part gives an overview of simple, hands-on improvements of research data management along the data life cycle. Many of the discipline specific tools and services presented in the talk are provided by the NFDI4Biodiversity consortium.",https://w3id.org/kim/hochschulfaechersystematik/n026,.pdf,biodiversity * research data management,en,Lecture,presentation,novice * advanced beginner,2024-06-05,student (school) * student (BA) * student (MA) * student (PhD) * teacher (school) * teacher (higher education) * researcher,isBasedOn:https://doi.org/10.5281/zenodo.7638635 * isBasedOn:https://doi.org/10.5281/zenodo.10649322 * isBasedOn:https://doi.org/10.5281/zenodo.6985361 * isNewerVersionOf:https://doi.org/10.5281/zenodo.1123545,3.7,2.0,1
,09141197-bc2e-43ff-a0bc-8c8d78f9fafc,,"Röder, Juliane : {https://orcid.org/0000-0002-4692-2700}",CC-BY-4.0,https://doi.org/10.5281/zenodo.11235458,Introduction to research data management,NFDI4Biodiversity (SR) * Philipps University of Marburg (SR),"Slides for a 60 min presentation on basic aspects of research data management. The first part discusses motivations and solutions for improved research data management specific for ecological and biodiversity data. The second part gives an overview of simple, hands-on improvements of research data management along the data life cycle. Many of the discipline specific tools and services presented in the talk are provided by the NFDI4Biodiversity consortium. Included is also an overview of generic tools and services provided by the local eResearch Center of the Philipps University of Marburg in close collaboration with the Hessian Research Data Infrastructures (HeFDI).",https://w3id.org/kim/hochschulfaechersystematik/n026,.pdf,biodiversity * research data management,en,Lecture,presentation,novice * advanced beginner,2024-05-21,student (school) * student (BA) * student (MA) * student (PhD) * teacher (school) * teacher (higher education) * researcher,isBasedOn:https://doi.org/10.5281/zenodo.7638635 * isBasedOn:https://doi.org/10.5281/zenodo.10649322 * isBasedOn:https://doi.org/10.5281/zenodo.6985361 * isNewerVersionOf:https://doi.org/10.5281/zenodo.1123545,5.8,1.0,2
,c42da4f4-e55a-4d4e-a53f-1adf8d4553e9,,"Fischer, Marlen * Röder, Juliane : {https://orcid.org/0000-0002-4692-2700} * Signer, Johannes : {https://orcid.org/0000-0002-1771-7775} * Tschink, Daniel : {https://orcid.org/0000-0001-8683-2534} * Weibulat, Tanja : {https://orcid.org/0000-0003-2976-2300} * Brand, Ortrun : {https://orcid.org/0000-0002-6850-5123}",CC-BY-4.0,https://doi.org/10.5281/zenodo.10377868,NFDI4Biodiversity Self-Study Unit - Research Data Management for Biodiversity Data,NFDI4Biodiversity (SR),This course provides an introduction to research data management specifically tailored to the needs of biologists and is offered by the Biodiversity Data Consortium NFDI4Biodiversity in cooperation with the Hessian Research Data Infrastructure HeFDI.,https://w3id.org/kim/hochschulfaechersystematik/n026,.pdf,biodiversity * research data management * data life cycle * data management plan * data collection * taxonomic data integration * data preservation * legal aspects * licenses,en,https://w3id.org/kim/hcrt/textbook,text,novice * advanced beginner,2023-12-14,student (school) * student (BA) * student (MA) * student (PhD) * teacher (school) * teacher (higher education) * researcher,isBasedOn:https://doi.org/10.5281/zenodo.6373596,2.8,1.0.0,3
,3d3ee205-33b6-40a6-8b71-2f852588c63a,,"Fischer, Marlen * Röder, Juliane : {https://orcid.org/0000-0002-4692-2700} * Signer, Johannes : {https://orcid.org/0000-0002-1771-7775} * Tschink, Daniel : {https://orcid.org/0000-0001-8683-2534} * Weibulat, Tanja : {https://orcid.org/0000-0003-2976-2300} * Brand, Ortrun : {https://orcid.org/0000-0002-6850-5123}",CC-BY-SA-4.0,https://ilias.uni-marburg.de/goto.php?target=pg_443261_3276691&client_id=UNIMR,Research Data Management for Biodiversity Data,NFDI4Biodiversity (SR) * Philipps University of Marburg (SR),This course provides an introduction to research data management specifically tailored to the needs of biologists and is offered by the Biodiversity Data Consortium NFDI4Biodiversity in cooperation with the Hessian Research Data Infrastructure HeFDI.,https://w3id.org/kim/hochschulfaechersystematik/n026,,biodiversity * research data management * data life cycle * data management plan * data collection * taxonomic data integration * data preservation * legal aspects * licenses,en,https://w3id.org/kim/hcrt/assessment,text,novice * advanced beginner,2023-12-20,student (school) * student (BA) * student (MA) * student (PhD) * teacher (school) * teacher (higher education) * researcher,isBasedOn:https://doi.org/10.5281/zenodo.6373596 * isNewerVersionOf:https://doi.org/10.5281/zenodo.10377868,,1.1.0,4
,9f7c35b1-72fb-4ad1-b84d-09fc77c36cd9,,"Fischer, Marlen * Röder, Juliane : {https://orcid.org/0000-0002-4692-2700} * Signer, Johannes : {https://orcid.org/0000-0002-1771-7775} * Tschink, Daniel : {https://orcid.org/0000-0001-8683-2534} * Weibulat, Tanja : {https://orcid.org/0000-0003-2976-2300} * Brand, Ortrun : {https://orcid.org/0000-0002-6850-5123}",CC-BY-4.0,https://github.com/NFDI4Biodiversity/nfdi4biodiversity-sle,Research Data Management for Biodiversity Data,NFDI4Biodiversity (SR) * Philipps University of Marburg (SR),This course provides an introduction to research data management specifically tailored to the needs of biologists and is offered by the Biodiversity Data Consortium NFDI4Biodiversity in cooperation with the Hessian Research Data Infrastructure HeFDI.,https://w3id.org/kim/hochschulfaechersystematik/n026,.md * .png,biodiversity * research data management * data life cycle * data management plan * data collection * taxonomic data integration * data preservation * legal aspects * licenses,en,https://w3id.org/kim/hcrt/assessment,text * image * code,novice * advanced beginner,2024-06-03,student (school) * student (BA) * student (MA) * student (PhD) * teacher (school) * teacher (higher education) * researcher,isBasedOn:https://doi.org/10.5281/zenodo.6373596 * isNewerVersionOf:https://doi.org/10.5281/zenodo.10377868 * isNewerVersionOf:https://ilias.uni-marburg.de/goto.php?target=pg_443261_3276691&client_id=UNIMR,2.9,1.2.0,5
,9d5c9188-25ea-4b84-8803-b1fc08fb1c6c,,"Grünberger, Tom : {https://orcid.org/0009-0001-1696-1944} * Brand, Ortrun : {https://orcid.org/0000-0002-6850-5123} *  Tschink, Daniel : {https://orcid.org/0000-0001-8683-2534} * Ebert, Barbara : {https://orcid.org/0000-0003-3328-6693}",CC-BY-SA-4.0,https://kb.gfbio.org/pages/viewpage.action?pageId=121143505,Rechtsdschungel,NFDI4Biodiversity (SR),"In diesem Podcast widmen wir uns den rechtlichen Aspekten im Umgang mit Biodiversitäts- und Umweltdaten. Für den Erhalt der Biodiversität ist eine zuverlässige Datenbasis und eine gute Datenverfügbarkeit unerlässlich. Dies beinhaltet natürlich auch die Notwendigkeit klarer rechtlicher Rahmenbedingungen für den Austausch und der Nutzung von Daten. Wir sehen es als unsere Verantwortung, Forschende und Datensammler:innen dabei zu unterstützen, rechtliche Angelegenheiten kompetent zu bewältigen. Dieser Podcast dient als Einstieg in ein Feld, das wir selbst noch erkunden. Wir laden unsere Zuhörer ein, uns auf dieser Reise durch den Rechtsdschungel zu begleiten. Die Episoden untersuchen verschiedene Aspekte des Zusammenspiels zwischen Recht und Wissenschaft, basierend auf den Fragen die unsere Partner in NFDI4Biodiversity beschäftigen und bieten ein  Verständnis der rechtlichen Rahmenbedingungen. ",https://w3id.org/kim/hochschulfaechersystematik/n026 * https://w3id.org/kim/hochschulfaechersystematik/n135,,Biodiversität * Recht * Lizenzen * Umweltinformationsgesetz,de,PodcastSeries,multipart,novice * advanced beginner,2023-11-06,student (school) * student (BA) * student (MA) * student (PhD) * teacher (school) * teacher (higher education) * researcher,,,,6
,c12fca86-98bf-4ac6-afda-61be896b1fb5,,"Witschas, Tom : {https://orcid.org/0009-0001-1696-1944} * Brand, Ortrun : {https://orcid.org/0000-0002-6850-5123} *  Tschink, Daniel : {https://orcid.org/0000-0001-8683-2534}",CC-BY-SA-4.0,https://kb.gfbio.org/pages/viewpage.action?pageId=121143505,Episode 1 - Rechte und Pflichten an Daten,NFDI4Biodiversity (SR),"Wem gehören Biodiversitäts- und Umweltdaten? In unserer ersten Episode widmen wir uns den Feinheiten von Besitz an Daten, Urheberrecht und geistigem Eigentum im Kontext kooperativer wissenschaftlicher Projekte. Lernen Sie Herausforderungen und bewährte Praktiken im Umgang mit Forschungsdaten kennen.",https://w3id.org/kim/hochschulfaechersystematik/n026 * https://w3id.org/kim/hochschulfaechersystematik/n135,,Biodiversität * Recht,de,Interview,audio,novice * advanced beginner,2023-11-06,student (school) * student (BA) * student (MA) * student (PhD) * teacher (school) * teacher (higher education) * researcher,isPartOf:https://kb.gfbio.org/pages/viewpage.action?pageId=121143505,,,7
,b2ea820f-191b-49c6-b8fe-f25812e21ac2,,"Witschas, Tom : {https://orcid.org/0009-0001-1696-1944} * Brand, Ortrun : {https://orcid.org/0000-0002-6850-5123} *  Tschink, Daniel : {https://orcid.org/0000-0001-8683-2534}",CC-BY-SA-4.0,https://kb.gfbio.org/pages/viewpage.action?pageId=121143505,Episode 2 - Lizenzen im Umgang mit Forschungsdaten,NFDI4Biodiversity (SR),In dieser Episode widmen wir uns der Rolle von Lizenzen im Umgang mit Forschungsdaten. Was genau sind Lizenzen und wie beeinflussen sie die (Wieder)verwendung von Forschungsdaten? Welche Lizenz sollten Sie für verschiedene Arten von Daten und unter welchen Umständen wählen?,https://w3id.org/kim/hochschulfaechersystematik/n026 * https://w3id.org/kim/hochschulfaechersystematik/n135,,Biodiversität * Recht * Lizenzen,de,Interview,audio,novice * advanced beginner,2023-11-21,student (school) * student (BA) * student (MA) * student (PhD) * teacher (school) * teacher (higher education) * researcher,isPartOf:https://kb.gfbio.org/pages/viewpage.action?pageId=121143505,,,8
,5a7779ee-49ea-445c-93d1-3dbebdb4132f,,"Witschas, Tom : {https://orcid.org/0009-0001-1696-1944} * Brand, Ortrun : {https://orcid.org/0000-0002-6850-5123} *  Tschink, Daniel : {https://orcid.org/0000-0001-8683-2534}",CC-BY-SA-4.0,https://kb.gfbio.org/pages/viewpage.action?pageId=121143505,"Episode 3 - Nationale und internationale Regelwerke, UIG und Co.",NFDI4Biodiversity (SR),"Die dritte Episode des Rechtspodcasts legt ihren Fokus auf nationale und internationale Regelwerke im Zusammenhang mit Umwelt- und Biodiversitätsdaten. Wir beleuchten die rechtlichen Rahmenbedingungen und Herausforderungen, die sich aus diesen Regelwerken ergeben. Von nationaler Seite aus betrachtet die Diskussion die Umsetzung des Umweltinformationsgesetzes (UIG) und die damit verbundenen Anforderungen an Institutionen, z.B. in Bezug auf die Lieferung von Firmendaten an Landesämter. Es wird analysiert, wie das UIG Institutionen beeinflusst, welche Anreize geschaffen werden können, um Datenlieferungen zu fördern, und welcher Informationsbedarf besteht. Internationale Regelwerke spielen ebenfalls eine wichtige Rolle. Dabei wird über internationale Abkommen und Vereinbarungen informiert, die die Erhebung und den Austausch von Umweltdaten zwischen Ländern regeln.",https://w3id.org/kim/hochschulfaechersystematik/n026 * https://w3id.org/kim/hochschulfaechersystematik/n135,,Biodiversität * Recht * Umweltinformationsgesetz,de,Interview,audio,novice * advanced beginner,2024-04-23,student (school) * student (BA) * student (MA) * student (PhD) * teacher (school) * teacher (higher education) * researcher,isPartOf:https://kb.gfbio.org/pages/viewpage.action?pageId=121143505,,,9
,81f6d8e5-6a30-42bd-83a7-77d9c9f9ce3b,,"Grünberger, Tom : {https://orcid.org/0009-0001-1696-1944} * Brand, Ortrun : {https://orcid.org/0000-0002-6850-5123} *  Tschink, Daniel : {https://orcid.org/0000-0001-8683-2534} * Ebert, Barbara : {https://orcid.org/0000-0003-3328-6693}",CC-BY-SA-4.0,https://kb.gfbio.org/pages/viewpage.action?pageId=121143505,Episode 4 - Institutionelle Perspektive,NFDI4Biodiversity (SR),"In unserer vierten Episode beleuchten wir die komplexe Landschaft der Verfügungsrechte an Daten und die damit verbundenen rechtlichen Rahmenbedingungen. Wir untersuchen, wie sich diese Rechte zwischen Universitäten, Verbänden oder Behörden unterscheiden. Ein besonderer Fokus liegt darauf wer letztendlich, unter Berücksichtigung der Beschäftigungsverhältnisse, über die Daten verfügen darf. Des Weiteren diskutieren wir die Bedeutung von Forschungsdatenpolicies und deren Wirksamkeit aus rechtlicher Sicht und erörtern verschiedene Möglichkeiten, den Umgang mit Daten zu regeln, insbesondere im Kontext von kooperativen Projekten um klare Regelungen zu schaffen und potenzielle Konflikte zu vermeiden. Hierbei stehen Kooperationsverträge, sowie Datenüberlassungs- und Datennutzungsverträge im Fokus.",https://w3id.org/kim/hochschulfaechersystematik/n026 * https://w3id.org/kim/hochschulfaechersystematik/n135,,Biodiversität * Recht * Verfügungsrechte * Forschungsdatenpolicy,de,Interview,audio,novice * advanced beginner,2023-07-03,student (school) * student (BA) * student (MA) * student (PhD) * data steward * teacher (school) * teacher (higher education) * researcher * content provider,isPartOf:https://kb.gfbio.org/pages/viewpage.action?pageId=121143505,,,10
,74eb3588-199d-4869-a9c3-0aca5a36fd20,,"Kostadinov, Ivaylo : {https://orcid.org/0000-0003-4476-6764} * Linares, Jimena : {https://orcid.org/0000-0003-3847-2663} * Kipker, Dennis-Kenji : {https://orcid.org/0000-0003-1454-591X} * Grenié, Matthias : {https://orcid.org/0000-0002-4659-7522} * Müller, Wolfgang : {https://orcid.org/0000-0002-4980-3512} * Oellermann, Michael : {https://orcid.org/0000-0001-5392-6737}",CC-BY-3.0,https://www.youtube.com/playlist?list=PL06Unzn1hDrhZ4mfsdfeypJajuGsuzdfm,Winter School Lectures,NFDI4Biodiversity (SR),"The Winter School aimed on Early-Career-Researcher (ECR´s) with a background in biodiversity and environmental science and took place in December 2022. It was a collaborative event between the Ecological Society (GfÖ) and the consortium NFDI4Biodiversity within the National Research Data Infrastructure Germany (NFDI). Various experts from the partner network (universities, data centers and research institutions) shared their widespread knowledge and trained participants in the fundamentals of Research Data Management (RDM) as well as cutting-edge technologies in handling environmental and biodiversity data across the Data Life Cycle (DLC). This is a collection of recorded lectures from this Winter School 2022.",https://w3id.org/kim/hochschulfaechersystematik/n026,,NFDI4Biodiversity and GfÖ Winter School 2022 * biodiversity * data management plan * data literacy * funding guidelines * taxonomic data integration * data integration * data annotation * data publication * data search * research data * data privacy * copyright law,en,Lecture,video,novice * advanced beginner,2023-05-04,student (school) * student (BA) * student (MA) * student (PhD) * teacher (school) * teacher (higher education) * researcher,isPartOf:https://doi.org/10.5281/zenodo.8221510,,,11
,d05a2e88-7f37-490f-951f-59dac365b22e,,"Kostadinov, Ivaylo : {https://orcid.org/0000-0003-4476-6764} * Linares, Jimena : {https://orcid.org/0000-0003-3847-2663}",CC-BY-3.0,https://www.youtube.com/watch?v=CUcgHrEdt-M,Data Management and Data Literacy,NFDI4Biodiversity (SR),"Learn more about the basics of Research Data Management and Data Literacy (e.g. research data types, FAIR principles, Data Management Plan) and what Funding Guidelines have to do with that.",https://w3id.org/kim/hochschulfaechersystematik/n026,,NFDI4Biodiversity and GfÖ Winter School 2022 * biodiversity * data management plan * data literacy * funding guidelines,en,Lecture,video,novice * advanced beginner,2023-05-04,student (school) * student (BA) * student (MA) * student (PhD) * teacher (school) * teacher (higher education) * researcher,isPartOf:https://www.youtube.com/playlist?list=PL06Unzn1hDrhZ4mfsdfeypJajuGsuzdfm * isPartOf:https://doi.org/10.5281/zenodo.8221510,,,12
,70dfbe15-7eef-492b-bf55-6e32c4f220b0,,"Grenié, Matthias : {https://orcid.org/0000-0002-4659-7522}",CC-BY-3.0,https://www.youtube.com/watch?v=vOgadsdBCeo,Taxonomic Harmonization,NFDI4Biodiversity (SR),"In this enlightening video, you delve into the realm of taxonomy. Discover the intricacies of ""taxonomic harmonization"" as we explore its definition, essential prerequisites, and practical execution. If you're engaged with biodiversity data, these vital insights on taxonomy are integral to your work.",https://w3id.org/kim/hochschulfaechersystematik/n026,,NFDI4Biodiversity and GfÖ Winter School 2022 * biodiversity * taxonomic data integration,en,Lecture,video,novice * advanced beginner,2023-05-04,student (school) * student (BA) * student (MA) * student (PhD) * teacher (school) * teacher (higher education) * researcher,isPartOf:https://www.youtube.com/playlist?list=PL06Unzn1hDrhZ4mfsdfeypJajuGsuzdfm * isPartOf:https://doi.org/10.5281/zenodo.8221510,,,13
,3dc75e62-f105-4020-8db0-e5c02f73802f,,"Müller, Wolfgang : {https://orcid.org/0000-0002-4980-3512}",CC-BY-3.0,https://www.youtube.com/watch?v=F350FyqCkWA,Data Integration and Annotation,NFDI4Biodiversity (SR),Learn more about structuring your data sets and how tools such as Google Refine and RightField can help you in annotating your data.,https://w3id.org/kim/hochschulfaechersystematik/n026,,NFDI4Biodiversity and GfÖ Winter School 2022 * biodiversity * data integration * data annotation,en,Lecture,video,novice * advanced beginner,2023-05-04,student (school) * student (BA) * student (MA) * student (PhD) * teacher (school) * teacher (higher education) * researcher,isPartOf:https://www.youtube.com/playlist?list=PL06Unzn1hDrhZ4mfsdfeypJajuGsuzdfm * isPartOf:https://doi.org/10.5281/zenodo.8221510,,,14
,b8995f5e-25b1-4be9-bc93-57b48ca9beb3,,"Oellermann, Michael : {https://orcid.org/0000-0001-5392-6737}",CC-BY-3.0,https://www.youtube.com/watch?v=agCfSBWdRXM,Data Search: Publish your Research Data pt. 1,NFDI4Biodiversity (SR),"Why should you publish data and where? Delve into the realms of databases, repositories.",https://w3id.org/kim/hochschulfaechersystematik/n026,,NFDI4Biodiversity and GfÖ Winter School 2022 * biodiversity * data publication * data search,en,Lecture,video,novice * advanced beginner,2023-05-04,student (school) * student (BA) * student (MA) * student (PhD) * teacher (school) * teacher (higher education) * researcher,isPartOf:https://www.youtube.com/playlist?list=PL06Unzn1hDrhZ4mfsdfeypJajuGsuzdfm * isPartOf:https://doi.org/10.5281/zenodo.8221510,,,15
,dba3ac21-4277-4f59-8522-cd9f270c461c,,"Oellermann, Michael : {https://orcid.org/0000-0001-5392-6737}",CC-BY-3.0,https://www.youtube.com/watch?v=U6kr3DfS9HA,Data Search: Publish your Research Data pt. 2,NFDI4Biodiversity (SR),Learn more about potential pitfalls in data description and gain expert guidance on the essential steps to ready your data for publication.,https://w3id.org/kim/hochschulfaechersystematik/n026,,NFDI4Biodiversity and GfÖ Winter School 2022 * biodiversity * data publication * data search,en,Lecture,video,novice * advanced beginner,2023-05-04,student (school) * student (BA) * student (MA) * student (PhD) * teacher (school) * teacher (higher education) * researcher,isPartOf:https://www.youtube.com/playlist?list=PL06Unzn1hDrhZ4mfsdfeypJajuGsuzdfm * isPartOf:https://doi.org/10.5281/zenodo.8221510,,,16
,2da86f9f-75f1-4326-aac3-0268b4b90de3,,"Kipker, Dennis-Kenji : {https://orcid.org/0000-0003-1454-591X}",CC-BY-3.0,https://www.youtube.com/watch?v=jHkHkCswbwM,Legal Aspects,NFDI4Biodiversity (SR),"Explore the legal challenges in research data management in this YouTube video. Dive into copyright, licenses, national and international data protection regulations, the world of open data, and many more.",https://w3id.org/kim/hochschulfaechersystematik/n026,,NFDI4Biodiversity and GfÖ Winter School 2022 * research data * data privacy * copyright law,en,Lecture,video,novice * advanced beginner,2024-04-02,student (school) * student (BA) * student (MA) * student (PhD) * teacher (school) * teacher (higher education) * researcher,isPartOf:https://www.youtube.com/playlist?list=PL06Unzn1hDrhZ4mfsdfeypJajuGsuzdfm * isPartOf:https://doi.org/10.5281/zenodo.8221510,,,17
,8a1d87d6-19cc-47bd-b289-15b26d4acc37,,"Kostadinov, Ivaylo : {https://orcid.org/0000-0003-4476-6764} * Linares, Jimena : {https://orcid.org/0000-0003-3847-2663} * Kipker, Dennis-Kenji : {https://orcid.org/0000-0003-1454-591X} * Grenié, Matthias : {https://orcid.org/0000-0002-4659-7522} * Oellermann, Michael : {https://orcid.org/0000-0001-5392-6737} * Tschink, Daniel : {https://orcid.org/0000-0001-8683-2534}",CC-BY-4.0,https://zenodo.org/communities/nfdi4biodiv/search?page=1&size=20&q=title:(%22Legal%22)%20OR%20(keywords:(%22winterschool2022%22%20OR%20%22WinterSchool2022%22%20OR%20%22Winterschool2022%22)%20AND%20(%22nfdi4biodiversity%22%20OR%20%22NFDI4Biodiversity%22)),Winter School Lectures - Slides,NFDI4Biodiversity (SR),"The Winter School aimed on Early-Career-Researcher (ECR´s) with a background in biodiversity and environmental science and took place in December 2022. It was a collaborative event between the Ecological Society (GfÖ) and the consortium NFDI4Biodiversity within the National Research Data Infrastructure Germany (NFDI). Various experts from the partner network (universities, data centers and research institutions) shared their widespread knowledge and trained participants in the fundamentals of Research Data Management (RDM) as well as cutting-edge technologies in handling environmental and biodiversity data across the Data Life Cycle (DLC). This is a collection of presentations from this Winter School 2022.",https://w3id.org/kim/hochschulfaechersystematik/n026,,NFDI4Biodiversity and GfÖ Winter School 2022 * biodiversity * data management plan * data literacy * funding guidelines * taxonomic data integration * data integration * data publication * data search * research data * data privacy * copyright law,en,Lecture,presentation,novice * advanced beginner,2022-12-09,student (school) * student (BA) * student (MA) * student (PhD) * teacher (school) * teacher (higher education) * researcher,isPartOf:https://doi.org/10.5281/zenodo.8221510,,,18
,ef829720-0dca-453e-acdc-5e720c171517,,"Kostadinov, Ivaylo : {https://orcid.org/0000-0003-4476-6764} * Tschink, Daniel : {https://orcid.org/0000-0001-8683-2534}",CC-BY-4.0,https://doi.org/10.5281/ZENODO.10075417,Data Management and Data Literacy,NFDI4Biodiversity (SR),"This presentation at the NFDI4Biodiversity & GfÖ Winter School 2022 focused on the fundamentals of Data Management and Data Literacy in the context of biodiversity research. Attendees gained insights into best practices for data collection, storage, sharing, and preservation. Further, the presentation emphasized the vital roles of NFDI4Biodiversity and GFBio services in fostering data-driven research, supporting data curation, and promoting a culture of data literacy within the biodiversity community.",https://w3id.org/kim/hochschulfaechersystematik/n026,,NFDI4Biodiversity and GfÖ Winter School 2022 * biodiversity * data literacy * funding guidelines,en,Lecture,presentation,novice * advanced beginner,2023-11-06,student (school) * student (BA) * student (MA) * student (PhD) * teacher (school) * teacher (higher education) * researcher,isPartOf:https://zenodo.org/communities/nfdi4biodiv/search?page=1&size=20&q=title:(%22Legal%22)%20OR%20(keywords:(%22winterschool2022%22%20OR%20%22WinterSchool2022%22%20OR%20%22Winterschool2022%22)%20AND%20(%22nfdi4biodiversity%22%20OR%20%22NFDI4Biodiversity%22)) * isPartOf:https://doi.org/10.5281/zenodo.8221510,4.1,1.0,19
,d03cf037-2d1f-4678-89c5-6f4004fd5f63,,"Linares, Jimena : {https://orcid.org/0000-0003-3847-2663} * Tschink, Daniel : {https://orcid.org/0000-0001-8683-2534}",CC-BY-4.0,https://doi.org/10.5281/ZENODO.7638635,"DMPs as part of local organisation, for FAIRness and policy compliance",NFDI4Biodiversity (SR),"The first step in the data life cycle involves planning. A data management plan (DMP) is a document that facilitates this. As formal documents, DMPs favor local organizations and guarantee FAIRness and policy compliance.",https://w3id.org/kim/hochschulfaechersystematik/n026,,NFDI4Biodiversity and GfÖ Winter School 2022 * biodiversity * data management plan * funding guidelines,en,Lecture,presentation,novice * advanced beginner,2023-02-14,student (school) * student (BA) * student (MA) * student (PhD) * teacher (school) * teacher (higher education) * researcher,isPartOf:https://zenodo.org/communities/nfdi4biodiv/search?page=1&size=20&q=title:(%22Legal%22)%20OR%20(keywords:(%22winterschool2022%22%20OR%20%22WinterSchool2022%22%20OR%20%22Winterschool2022%22)%20AND%20(%22nfdi4biodiversity%22%20OR%20%22NFDI4Biodiversity%22)) * isPartOf:https://doi.org/10.5281/zenodo.8221510,2.2,1.0,20
